{
  "schema_version": 1,
  "task": "2026-10-08-denim-system-config",
  "kind": "active",
  "last_updated": "2026-10-20T14:55:12Z",
  "networks": {
    "zeronet": {
      "step": "executed",
      "pr": "https://github.com/base/contract-deployments/pull/808",
      "blocksec_ticket": null,
      "signatures": {},
      "executed_tx": "0x2bf7928e72e17a4657a3fd24e33907574881b63878ac04d0cfeaa5e7af880a5b"
    },
    "sepolia": {
      "step": "ready_to_sign",
      "pr": null,
      "blocksec_ticket": null,
      "signatures": {},
      "executed_tx": null
    }
  }
}
