{
  "schema_version": 1,
  "task": "2026-10-21-replace-balance-tracker",
  "kind": "active",
  "networks": {
    "sepolia": {
      "step": "executed",
      "pr": "https://github.com/base/contract-deployments/pull/807",
      "blocksec_ticket": null,
      "signatures": {
        "base": {
          "collected": 3,
          "required": 3
        }
      },
      "executed_tx": "0x1d9e7be871ea17c1fc215940e01c19dfabbb67ace76d83275ac72f0609096789"
    }
  },
  "last_updated": "2026-10-28T17:34:35Z"
}
